{
  "schema_version": "pramaan.receipt.v1",
  "stage": "static_python_mypy",
  "status": "not_applicable",
  "tool": {
    "name": "pramaan-python-static",
    "version": "0.1.0"
  },
  "started_at": "2026-05-18T21:06:23Z",
  "ended_at": "2026-05-18T21:06:23Z",
  "inputs": [
    {
      "name": "repository",
      "value": "."
    }
  ],
  "outputs": [
    {
      "name": "static_receipt",
      "path": "receipts/static/python-mypy.receipt.json"
    }
  ],
  "artifacts": [
    {
      "name": "static_command",
      "path": "mypy .",
      "media_type": "text/x-shellscript"
    }
  ],
  "summary": {
    "title": "Python mypy not applicable",
    "details": "no Python files were discovered"
  },
  "limitations": [
    "No static evidence was produced because no Python files were discovered."
  ],
  "mitigated_risks": [],
  "residual_risks": [
    "R-031",
    "R-032"
  ],
  "not_applicable_risks": [
    "R-038"
  ],
  "metadata": {
    "command": "mypy .",
    "configured": "false",
    "duration_ms": "0",
    "language": "python"
  }
}