{
  "schema_version": "pramaan.receipt.v1",
  "stage": "static_python_compileall",
  "status": "passed",
  "tool": {
    "name": "pramaan-python-static",
    "version": "0.1.0"
  },
  "started_at": "2026-05-21T13:45:08Z",
  "ended_at": "2026-05-21T13:45:09Z",
  "exit_code": 0,
  "inputs": [
    {
      "name": "repository",
      "value": "."
    }
  ],
  "outputs": [
    {
      "name": "static_receipt",
      "path": "receipts/static/python-compileall.receipt.json"
    }
  ],
  "artifacts": [],
  "summary": {
    "title": "Python compileall passed",
    "details": "command produced no output"
  },
  "limitations": [
    "Static checks are command evidence only; they do not prove semantic correctness."
  ],
  "mitigated_risks": [
    "R-031",
    "R-032",
    "R-038"
  ],
  "residual_risks": [
    "R-039",
    "R-040"
  ],
  "not_applicable_risks": [],
  "metadata": {
    "command": "python -m compileall -q .",
    "configured": "true",
    "duration_ms": "310",
    "hallucination_categories": "unknown",
    "language": "python",
    "relaxed_static_config": "clippy_allows,eslint_disable,mypy_ignore_errors,typescript_skip_lib_check,typescript_strict_false",
    "security_sensitive_categories": "auth,crypto,deserialization,filesystem,network,secrets,sql,subprocess",
    "tool_executed": "python",
    "tool_executed_version": "Python 3.12.3"
  }
}